Template Use Case/Title,Applicable SOPs,Text,Last Updated
Adhoc Order Status Update,Tier 1 Ad Hoc Requests SOP (DSC2S),"Hi Wayfair Team, Thank you for reaching out about the status of this PO; I&rsquo;m happy to help. I have updated any tracking as appropriate for our supplier team as requested. I have refreshed this PO to ensure this has been updated in Partner Home. If our supplier requires further support on this request, please submit a new request on the suppliers behalf in Partner Home utilizing the following request path: Help & Support > Submit a Ticket > Dropship Order Fulfillment > Problem Fulfilling an Order > General Fulfillment Help Thank you,",
Adhoc Cancellation Approved,Tier 1 Ad Hoc Requests SOP (DSC2S),"Hi Wayfair Team, Thank you for reaching out about this PO; I&rsquo;m happy to help. As requested, I have processed and confirmed cancellation of this PO. I have also refreshed this PO to ensure this status has been updated in Partner Home for our supplier. If our supplier requires further support on this request, please submit a new request on the suppliers behalf in Partner Home utilizing the following request path: Help & Support > Submit a Ticket > Dropship Order Fulfillment > Problem Fulfilling an Order > General Fulfillment Help Thank you,",
Adhoc Incorrect Tix Entered,Tier 1 Ad Hoc Requests SOP (DSC2S),"Hello Wayfair Team, Thank you for reaching out on this. Please note that this request type is limited to providing support for (Please provide specific Denial Reason) . This ticket will be closed as the request is out of scope. This request type is not supplier facing, so please note supplier partners are unable to view or respond to this request. If supplier visibility is required on this request, please submit a new request on the suppliers behalf in Partner Home utilizing the following request path: Help & Support > Submit a Ticket > Dropship Order Fulfillment > Problem Fulfilling an Order > General Fulfillment Help Thank you,",
Manifest Request magenta location EU Specific,Tier 1 Ad Hoc Requests SOP (DSC2S),"Hi Team, Our Logistics team has advised that {PO NUMBER} was collected but there are no carrier scans available. To mark this order as shipped, could you please attach a signed manifest or a working tracking number? Alternatively, you can add the tracking information through Customer Orders > Dropship Orders, following this guide - https://partners.wayfair.com/help/2/article/1252 Please provide this at your earliest convenience to avoid any collection issues or delays for our mutual customers. This is in relation to (TICKET NUMBER). I look forward to your response. Thanks in advance. Kind Regards,",
New Label Provided magenta location EU Specific,Tier 1 Ad Hoc Requests SOP (DSC2S),"Hi Team, Our Logistics team has advised that {CARRIER} requires a new label to collect {PO NUMBER}. Please find the new label attached to this ticket, to be applied to the PO carton in advance of your next collection. This is in relation to (TICKET NUMBER). If required, please delay this PO on Partner Home. You can find the instructions on how to do so here: https://partners.wayfair.com/help/2/article/1440 Please let me know if you have any questions. I am marking this ticket as complete. If you need further support with this issue, please comment to re-open. Kind Regards,",