Template Use Case/Title,Applicable SOPs,Text,Last Updated
Drop Trailer Supplier Ticket Update,,"Hi SUPPLIER_NAME, TAILORED_EMPATHY/ASSURANCE_STATEMENT We are showing that your next scheduled pick up for ENTER_PO is on ENTER_DATE with CARRIER_NAME. Help us improve by sharing your feedback. You will receive an email shortly with a survey, or you can provide feedback on any closed tickets in Partner Home. We sincerely value your partnership. CLOSING, FIRST_NAME_LAST_INITIAL",
FTL Back Order,Insert link to SOP,"Hi SUPPLIER_NAME, TAILORED_EMPATHY/ASSURANCE_STATEMENT [PO Number] Our records indicate that this PO is on backorder until the end of day on ENTER_DATE. When the Backorder status falls off, it will be scheduled as soon as possible. If this PO is available/ready sooner than the backorder date, please re-register the PO for pick up and select a new Ready for pick up Date at that time. Help us improve by sharing your feedback. You will receive an email shortly with a survey, or you can provide feedback on any closed tickets in Partner Home. We sincerely value your partnership. CLOSING, FIRST_NAME_LAST_INITIAL",
FTL PO - Today's Load,,"Hi SUPPLIER_NAME, TAILORED_EMPATHY/ASSURANCE_STATEMENT ENTER_PO is on today&rsquo;s pick up manifest. Please have the freight staged for pickup. Help us improve by sharing your feedback. You will receive an email shortly with a survey, or you can provide feedback on any closed tickets in Partner Home. We sincerely value your partnership. CLOSING, FIRST_NAME_LAST_INITIAL",
FTL Registered Today,,"Hi SUPPLIER_NAME, TAILORED_EMPATHY/ASSURANCE_STATEMENT ENTER_PO will automatically be scheduled as soon as possible. Help us improve by sharing your feedback. You will receive an email shortly with a survey, or you can provide feedback on any closed tickets in Partner Home. We sincerely value your partnership. CLOSING, FIRST_NAME_LAST_INITIAL",
FTL Rescheduled Pick Up,,"Hi SUPPLIER_NAME, TAILORED_EMPATHY/ASSURANCE_STATEMENT ENTER_PO will be added to the next scheduled pick up. Help us improve by sharing your feedback. You will receive an email shortly with a survey, or you can provide feedback on any closed tickets in Partner Home. We sincerely value your partnership. CLOSING, FIRST_NAME_LAST_INITIAL",
MSOD passed RFP not Arrived,,"Hi SUPPLIER_NAME, TAILORED_EMPATHY/ASSURANCE_STATEMENT This ENTER_PO was registered on ENTER_DATE with a ready for pick up date of ENTER_DATE. The ready for pickup date is when the PO will be added to the pick up manifest. If this PO is available/ready sooner than the ready for pick up date, please re-register the PO and select a new ready for pick up date at that time. Help us improve by sharing your feedback. You will receive an email shortly with a survey, or you can provide feedback on any closed tickets in Partner Home. We sincerely value your partnership. CLOSING, FIRST_NAME_LAST_INITIAL",
OTR Supplier Ticket Update,,"Hi SUPPLIER_NAME, TAILORED_EMPATHY/ASSURANCE_STATEMENT Your next scheduled pick up is on ENTER_DATE. Help us improve by sharing your feedback. You will receive an email shortly with a survey, or you can provide feedback on any closed tickets in Partner Home. We sincerely value your partnership. CLOSING, FIRST_NAME_LAST_INITIAL",
FedEx (SP) Shipments,,"Hello SUPPLIER_NAME, Thank you for reaching out regarding this pickup request. We apologize for the frustration and are able to provide support with this issue. For assistance scheduling a FedEx pickup, please reach out to FedEx directly by calling 1-800-463-3399 and providing your shipper account number. If you do not have a shipper account set up, the link to the Wayfair Help Center below will guide you through the steps. You may also reach out to your local FedEx representative for assistance with pickup delays. Once the pickup is scheduled it will appear on Partner Home and you will not need to send Wayfair a shipping confirmation. If you need an address changed for your pickup please use the help center article below: https://partners.wayfair.com/help/2/article/1432 Help us improve by sharing your feedback. You will receive an email shortly with a survey, or you can provide feedback on any closed tickets in Partner Home. We sincerely value your partnership. Thank you, [Agent Name]",