Template Use Case/Title,Applicable SOPs,Text,Last Updated
Multiple POs on a Ticket,Best Practices and Ticket Etiquette (DSC2S),"Hello [supplier name], Thank you for reaching out. I apologize for the issues you have faced with these PO&rsquo;s. Due to the quantity of PO&rsquo;s that are having issues, this issue will be addressed outside of this ticket. Although I will be closing this ticket, we will provide an update for you once these issues have been resolved. Thank you,",
SRM Non Responsive Escalation,Requesting Ticket Help via Slack Workflows (DSC2S),"Hi [Supplier Name], Thank you so much for alerting me to this issue. I completely understand the importance of a timely response in this situation, and apologize for the lack of follow up on this. I want to assure you that we take these matters seriously, and as such, I have escalated this directly to my management team for visibility and follow up. They will establish contact with you directly via a new thread shortly, and will be working to provide support and facilitate a resolution as quickly as possible. I appreciate your patience and understanding while we look into this matter further. If you have additional questions or concerns in the meantime, please feel free to reach back out in this thread, and I'm happy to assist. Thank you,",
Reopen - No Response Needed,Best Practices and Ticket Etiquette (DSC2S),Closing ticket as no additional assistance needed,
Duplicate Ticket,Best Practices and Ticket Etiquette (DSC2S),"Hi SUPPLIER_NAME, TAILORED_EMPATHY/ASSURANCE_STATEMENT The original request for ENTER_PO in ENTER_TICKET is still currently in queue pending a resolution. Please be advised that opening multiple tickets for the same issue can cause a delay in response time from our team. While we understand that this issue is pressing, we ask that you allow a minimum of 1 business day for our team to research and address your inquiry. For ongoing updates, please reference ENTER_TICKET. I will be closing this ticket. Help us improve by sharing your feedback. You will receive an email shortly with a survey, or you can provide feedback on any closed tickets in Partner Home. We sincerely value your partnership. CLOSING, FIRST_NAME_LAST_INITIAL",
Internal Collaboration Notice,Applicable to any SOP,"(Hi Supplier), Thank you for reaching out about this issue. I am happy to review this with you further today. We are collaborating with an internal team for assistance with your [SPECIFY REQUEST/ISSUE]. The average turnaround time for these requests is [NUMBER] business days. Once an update is available, we will update the thread with more information. For the time being, this ticket will remain open in a pending status. T hank you for bearing with us through this process. Your patience and flexibility is greatly appreciated.",
green location NA Specific Pushback on FedEx Daily Pickups (SP),,"Hi [SUPPLIER NAME], Thank you for reaching out. I'm happy to address this for you today. If you do not currently have daily pickups from Fedex, you can schedule your own pickups by calling Fedex when needed as a ""Next Day On Call"" (NDOC). Through this process, you are responsible for calling FedEx to request a next day pickup. You may find the procedure below. Please call FedEx (1-800-GO-FEDEX; say ""Ground Pickup""; provide your own FedEx Account Number and Address) by 4PM to request a Next Day Pickup. You must use your own FedEx account number to schedule this pickup. You can also register for pickup online (Schedule a one-time pickup or recurring pickups | FedEx). Scheduling a ""one time pickup"" is the online equivalent of NDOC. You will receive a pickup the next day in the time window committed by FedEx. Product must be ready for pickup by the beginning of the pickup window. FedEx will induct the product into their network that evening, triggering a Ship Confirm notification to the customer If you use Partner Home to print FedEx labels, it is absolutely imperative that you schedule the NDOC pickup using your FedEx account number (associated with your physical shipping address). If the supplier does not use the correct address, they are responsible for any failures to receive pickups. This process enables all packages to be shipped within 24 hours. You can also contact your local FedEx sales representative to enroll in this process. As outlined in our contract, Wayfair is not responsible for and will not reimburse pick up fees (charged by FedEx directly to the supplier). It is true that there is an additional charge associated with NDOC, but the weekly maximum fee for NDOC of $20 is $3/week more expensive than recurring ground pick ups ($17/week). Please let us know if you have questions. Thanks again for reaching out. I am marking this ticket as complete. If you need further support with this issue, please comment to re-open. Help us improve by sharing your feedback. You will receive an email shortly with a survey, or you can provide feedback on any closed tickets in Partner Home. We sincerely value your partnership. Thank you,",
PO Status Confirmation,,"Hello [Supplier Name], Thank you for reaching out regarding this PO&rsquo;s status. We appreciate your consideration for our mutual customer. I can review [PO Number] with you today. I have reviewed this order status and can confirm you should proceed with fulfillment. For future instances, if there is no cancellation on the order, then you can assume that the customer does want the item. Please process this PO for fulfillment if it is available or submit a delay as needed if it is out of stock. You can also refer to Dropship Orders for PO details and statuses. We want to make sure all your concerns are heard, so if this issue persists, please feel free to reach back out in this thread, and I will be happy to further assist. Otherwise, if I've resolved your concerns for the time being, I hope you have a great day! Help us improve by sharing your feedback. You will receive an email shortly with a survey, or you can provide feedback on any closed tickets in Partner Home. We sincerely value your partnership. Thank you, [Agent Name]",
Replacement Part Policy Questions,,"Hello Wayfair Partner, Thank you for this inquiry. Please note that any inquiries related to the below scenarios for PO# [Part PO Number(s)] will need to be handled by your Supplier Relationship Manager (SRM). Disputes parts as the resolution Needs clarity on our replacement part SLAs Needs clarity on our replacement part eligibility Needs clarity on their lead time, part availability Disputes our charges & deductions policy As such, please email your SRM, [include SRM first and last name], directly. By following this guideline, we can work together to streamline the processing of replacement parts, maintain accurate ownership between teams, and deliver a superior customer experience. Thank you for your cooperation and commitment to our mutual customer experience. I am marking this ticket as complete. If you need further support with this issue, please comment to re-open. Help us improve by sharing your feedback. You will receive an email shortly with a survey, or you can provide feedback on any closed tickets in Partner Home. We sincerely value your partnership. Kind regards, [Agent]",
NMFC and Freight Code Requests,NMFC and Freight Code Requests SOP (DSC2S),"Hi {SU name}/Team, Thank you for reaching out. To ensure your products are classified correctly, we recommend referencing the National Motor Freight Traffic Association (NMFTA) guidelines. Because freight classes and NMFC codes are highly specific to individual items factoring in density, handling, stowability, materials used, intended use of items and liability, referring directly to these guidelines is the best way to ensure the accuracy of your specific catalog. Thanks again for reaching out. I am marking this ticket as complete. If you need further support with this issue, please comment to re-open. Help us improve by sharing your feedback. You will receive an email shortly with a survey, or you can provide feedback on any closed tickets in Partner Home. We sincerely value your partnership. Kind Regards,",